{
  "schema_version": "0.2.0",
  "task_id": "bounded-lock-peer",
  "source_hash": "1e98eeea29dbbf19",
  "model_mix": [
    "gemma2:2b",
    "gemma4:e2b",
    "gemma4:latest",
    "mistral-small:latest"
  ],
  "population_size": 16,
  "generations": 1,
  "independence": "full",
  "error_correlation_risk": "low",
  "constraint_view_used": false,
  "blind_view_used": false,
  "project_mutated": false,
  "ground_truth": "close() is the only method touching self._conn without holding self._lock, so teardown can free the SQLite connection while a background daemon thread is mid-execute, giving a use-after-free in the sqlite3 C extension.",
  "admissible_set_contains_ground_truth": true,
  "graded_by": {
    "who": "objective CULPRIT-line match against fix commit bda0802",
    "blind_to_condition": true
  },
  "cost": {
    "tokens": 0,
    "path_invocations": 20,
    "wall_clock_s": null
  },
  "condition": "mixed-models",
  "model": "4-model local peer convergence (no privileged parent)",
  "artifact_dir": "local/peer/",
  "final_answer": "CULPRIT=close",
  "matches_ground_truth": true,
  "completion_status": "STABLE_HIGH_CONFIDENCE",
  "false_attractor_warnings": [],
  "notes": "PEER CONVERGENCE. Stage 1: four models x4 samples = 16 candidates. Stage 2: the SAME four models each judge a DEDUPLICATED candidate list with vote counts stripped, against the code. Verdicts: {'gemma2:2b': 'claim_for_processing', 'gemma4:e2b': 'close', 'gemma4:latest': 'close', 'mistral-small:latest': 'close'}. Consensus close at 3/4. Correct answer was 3/16 in the pool, so majority vote buried it. No model above 14.3GB and no frontier model anywhere in the loop. KEY: gemma4:e2b generated mark_result_published 4/4 in stage 1 and judged close in stage 2 -- a within-model generate/verify flip. CAVEAT: the stage-2 prompt supplied the checking rule ('a method touching self._conn without holding self._lock is the fault'), which the experimenter knew. Whether the models can derive that rule unaided is tested separately. SCHEMA GAP: the condition enum has no value for peer convergence without a privileged parent; recorded as mixed-models."
}
