{
  "schema_version": "0.2.0",
  "task_id": "milcah-queue-path",
  "source_hash": "9a09d47db8b3cd53",
  "condition": "single-path",
  "model": "claude-opus-5[1m]",
  "model_mix": [
    "claude-opus-5[1m]"
  ],
  "population_size": 1,
  "generations": 1,
  "independence": "reduced",
  "error_correlation_risk": "high",
  "constraint_view_used": false,
  "blind_view_used": false,
  "project_mutated": false,
  "artifact_dir": "runs/milcah-queue-path/single-path",
  "final_answer": "Correctly identifies the cwd-relative db_path default as splitting Milcah's queue from the daemon's database with start_worker=False leaving nothing to drain it, and proposes the ground-truth fix of delegating the default to Hoglah's own config.",
  "ground_truth": "HoglahExtractorConfig defaults db_path to a cwd-relative path (data/hoglah/jobs.sqlite3). Milcah submits with start_worker=False, so an external worker must be draining the same database - but the installed worker drains ~/.hoglah/hoglah.db. Every specialist call therefore wrote into a private, cwd-relative queue that nothing was watching, and blocked until its timeout. The fix is to take the defaults from Hoglah's own config so the two cannot disagree, and honour HOGLAH_DB_PATH.",
  "matches_ground_truth": true,
  "admissible_set_contains_ground_truth": null,
  "completion_status": "SETTLED_BY_VERIFICATION",
  "graded_by": {
    "who": "independent LLM grader agent, given ground truth and candidate only",
    "blind_to_condition": true
  },
  "false_attractor_warnings": [],
  "cost": {
    "tokens": 80948,
    "path_invocations": 1,
    "wall_clock_s": 194.9
  },
  "notes": "Difficulty screen. Grader: 2 notable error(s); calibration well-calibrated. Snapshot is git-archive of the parent of fix commit 4f36420; fix unreachable, no .git, no answer leakage, no contaminating installed dependency. Multipath arms not run: single-path already matched ground truth, so this task cannot discriminate between conditions on accuracy."
}
