{
  "schema_version": "0.2.0",
  "task_id": "mahalath-witness-race",
  "source_hash": "3ce00112ba878a1b",
  "condition": "single-path",
  "model": "claude-opus-5[1m]",
  "model_mix": [
    "claude-opus-5[1m]"
  ],
  "population_size": 1,
  "generations": 1,
  "independence": "reduced",
  "error_correlation_risk": "high",
  "constraint_view_used": false,
  "blind_view_used": false,
  "project_mutated": false,
  "artifact_dir": "runs/mahalath-witness-race/single-path",
  "final_answer": "Commits to a single mechanism and states it exactly: the resolved flag is published at line 48 before the handle is assigned at line 53, racing threads take the fast path and get None, and the fix is double-checked locking with the flag set last.",
  "ground_truth": "The trace witness's _database() lazy initialiser sets self._db_resolved = True before assigning self._db. A second thread arriving while the MongoClient is still being constructed sees the resolved flag already True, returns self._db - which has not been assigned yet - and its events are silently skipped. There is no lock around the initialisation. The fix is to lock the initialisation and set the resolved flag last, after the handle is assigned.",
  "matches_ground_truth": true,
  "admissible_set_contains_ground_truth": null,
  "completion_status": "SETTLED_BY_VERIFICATION",
  "graded_by": {
    "who": "independent LLM grader agent, given ground truth and candidate only",
    "blind_to_condition": true
  },
  "false_attractor_warnings": [],
  "cost": {
    "tokens": 54951,
    "path_invocations": 1,
    "wall_clock_s": 142.5
  },
  "notes": "Difficulty screen. Grader: 0 notable error(s); calibration well-calibrated. Snapshot is git-archive of the parent of fix commit 90a2ea3; fix unreachable, no .git, no answer leakage, no contaminating installed dependency. Multipath arms not run: single-path already matched ground truth, so this task cannot discriminate between conditions on accuracy."
}
